pmarcelino/comprehensive-data-exploration-with-python, Comprehensive data exploration with Python,Pedro Marcelino, PhD, 2019-08-23 08:19:02, 11425,1
startupsci/titanic-data-science-solutions, Titanic Data Science Solutions,Manav Sehgal, 2019-02-11 01:21:23,8293,1
alexisbcook/titanic-tutorial,Titanic Tutorial,Alexis Cook,2021-09-13 19:51:40,6645,1
serigne/stacked-regressions-top-4-on-leaderboard,Stacked Regressions : Top 4% on LeaderBoard, Serigne,2017-12-16 11:57:12,6331,1
yassineghouzam/introduction-to-cnn-keras-0-997-top-6,Introduction to CNN Keras - 0.997 (top 6%),Yassine Ghouzam,2017-08-18 01:42:23,6149,1
colinmorris/hello-python,Hello, Python, ColinMorris,2021-11-11 14:28:00,5959,1
kanncaa1/data-sciencetutorial-for-beginners, Data ScienceTutorial for Beginners,DATAI,2020-05-19 00:29:44,5721,1
arthurtok/introduction-to-ensembling-stacking-in-python, Introduction to Ensembling/Stacking in Python, Anisotropic,2018-06-16 14:41:15,5485,1
dansbecker/how-models-work,How Models Work, DanB, 2022-01-05 13:51:41,5316,1
ldfreeman3/a-data-science-framework-to-achieve-99-accuracy,A Data Science Framework: To Achieve 99% Accuracy, LD Freeman, 2017-12-31 18:27:17,4877,1
janiobachmann/credit-fraud-dealing-with-imbalanced-datasets, Credit Fraud,|| Dealing with Imbalanced Datasets, Janio Martinez Bachmann,2019-07-03 23:04:48,3735,1
willkoehrsen/start-here-a-gentle-introduction, Start Here: A Gentle Introduction, Will Koehrsen,2018-08-25 02:00:07,3199,1
colinmorris/functions-and-getting-help,Functions and Getting Help,ColinMorris,2021-11-11 14:28:17,2968,1
dansbecker/your-first-machine-learning-model,Your First Machine Learning Model, DanB, 2021-11-09 00:01:04,2910,1
dansbecker/model-validation, Model Validation,DanB, 2021-11-09 00:00:51,2659,1
yassineghouzam/titanic-top-4-with-ensemble-modeling, Titanic Top 4% with ensemble modeling, Yassine Ghouzam,2017-08-09 14:34:44,2562,1
dansbecker/underfitting-and-overfitting, Underfitting and Overfitting,DanB, 2021-11-09 00:01:33,2501,1
colinmorris/booleans-and-conditionals, Booleans and Conditionals, ColinMorris,2021-11-11 14:28:25,2492,1
yogeshtak/exercise-your-first-machine-learning-model,Exercise: Your First Machine Learning Model, Yogesh Tak, 2020-01-03 14:51:27,2437,1
alexisbcook/getting-started-with-kaggle, Getting Started with Kaggle, Alexis Cook,2021-08-05 13:03:30,2329,1
gzuidhof/full-preprocessing-tutorial,Full Preprocessing Tutorial, Guido Zuidhof,2017-02-24 06:16:38,2304,1
ash316/eda-to-prediction-dietanic, EDA To Prediction(DieTanic), Ashwini Swain,2018-03-08 17:55:32,2268,1
kanncaa1/machine-learning-tutorial-for-beginners,Machine Learning Tutorial for Beginners, DATAI,2018-07-24 14:43:45,2127,1
sudalairajkumar/winning-solutions-of-kaggle-competitions,Winning solutions of kaggle competitions,SRK,2020-06-15 14:38:04,2110,1
residentmario/creating-reading-and-writing,Creating, Reading and Writing, Aleksey Bilogur,2022-02-08 16:43:57,2059,1
kanncaa1/deep-learning-tutorial-for-beginners, Deep Learning Tutorial for Beginners,DATAI,2019-05-25 14:42:24,2059,1
thebrownviking20/everything-you-can-do-with-a-time-series, Everything you can do with a time series,Siddharth Yadav,2018-08-02 14:42:50,1946,1
therealcyberlord/coronavirus-covid-19-visualization-prediction,Coronavirus (COVID-19) Visualization & Prediction, Xingyu Bian,2022-02-08 16:34:36,1928,1
abhishek/approaching-almost-any-nlp-problem-on-kaggle, Approaching (Almost) Any NLP Problem on Kaggle,Abhishek Thakur,2020-07-22 06:02:35,1897,1
shivamb/data-science-glossary-on-kaggle, Data Science Glossary on Kaggle, Shivam Bansal,2018-12-10 09:47:14,1896,1
dansbecker/random-forests, Random Forests,DanB, 2021-11-09 00:03:02,1710,1
imdevskp/covid-19-analysis-visualization-comparisons,COVID-19 - Analysis, Visualization & Comparisons,Devakumar K. P.,2020-06-19 15:51:01,1708,1
colinmorris/lists, Lists, ColinMorris,2021-11-11 14:28:25,1649,1
jagangupta/time-series-basics-exploring-traditional-ts,Time series Basics : Exploring traditional TS, Jagan,2018-03-02 18:21:54,1624,1
dansbecker/submitting-from-a-kernel, Submitting From A Kernel,DanB, 2018-01-22 19:25:43,1616,1
apapiu/regularized-linear-models,Regularized Linear Models, Alexandru Papiu,2017-04-21 05:50:08,1613,1
dansbecker/basic-data-exploration, Basic Data Exploration,DanB, 2021-11-09 00:01:19,1551,1
kanncaa1/feature-selection-and-data-visualization, Feature Selection and Data Visualization,DATAI,2021-07-10 16:05:36,1524,1
residentmario/indexing-selecting-assigning,Indexing, Selecting & Assigning, Aleksey Bilogur,2022-02-08 16:40:11,1492,1
gunesevitan/titanic-advanced-feature-engineering-tutorial, Titanic - Advanced Feature Engineering Tutorial, Gunes Evitan, 2020-01-20 10:16:43,1463,1
colinmorris/loops-and-list-comprehensions, Loops and List Comprehensions, ColinMorris,2021-11-11 14:28:13,1432,1
anokas/data-analysis-xgboost-starter-0-35460-lb, Data Analysis & XGBoost Starter (0.35460 LB),anokas, 2017-04-12 14:22:20,1384,1
omarelgabry/a-journey-through-titanic, A Journey through Titanic, OMAR ELGABRY, 2016-11-15 18:19:03,1379,1
colinmorris/working-with-external-libraries, Working with External Libraries, ColinMorris,2021-11-11 14:28:12,1350,1
colinmorris/strings-and-dictionaries,Strings and Dictionaries,ColinMorris,2021-11-11 14:28:03,1345,1
masumrumi/a-statistical-analysis-ml-workflow-of-titanic, A Statistical Analysis & ML workflow of Titanic, Masum Rumi, 2021-11-15 20:01:34,1339,1
dansbecker/explore-your-data,Explore Your Data, DanB, 2019-01-23 01:07:33,1328,1
kanncaa1/plotly-tutorial-for-beginners,Plotly Tutorial for Beginners, DATAI,2019-10-01 20:59:55,1254,1
tanulsingh077/twitter-sentiment-extaction-analysis-eda-and-model,Twitter sentiment Extaction-Analysis,EDA and Model,Mr_KnowNothing, 2020-04-14 10:09:10,1253,1
deffro/eda-is-fun, EDA is Fun!, Dimitrios Effrosynidis, 2018-10-09 11:18:30,1246,1
benhamner/python-data-visualizations,Python Data Visualizations,Ben Hamner, 2017-08-29 15:54:22,1245,1
rohanrao/tutorial-on-reading-large-datasets, Tutorial on reading large datasets,Vopani, 2020-12-14 17:13:08,1240,1
dansbecker/handling-missing-values,Handling Missing Values, DanB, 2019-02-26 02:31:25,1235,1
ibtesama/getting-started-with-a-movie-recommendation-system, Getting Started with a Movie Recommendation System,Ibtesam Ahmed,2020-05-16 05:44:58,1233,1
tanulsingh077/deep-learning-for-nlp-zero-to-transformers-bert, Deep Learning For NLP: Zero To Transformers & BERT,Mr_KnowNothing, 2020-04-13 17:19:49,1218,1
rtatman/getting-started-in-r-first-steps,Getting staRted in R: First Steps, Rachael Tatman, 2017-12-01 21:49:24,1215,1
gpreda/santander-eda-and-prediction, Santander EDA and Prediction,Gabriel Preda,2019-04-03 16:47:19,1191,1
shahules/basic-eda-cleaning-and-glove, Basic EDA,Cleaning and GloVe,Shahules, 2019-12-31 05:57:44,1144,1
rtatman/data-cleaning-challenge-handling-missing-values, Data Cleaning Challenge: Handling missing values,Rachael Tatman, 2018-03-30 21:18:56,1144,1
sinakhorami/titanic-best-working-classifier, Titanic best working Classifier, Sina, 2016-12-18 17:09:08,1140,1
kanncaa1/pytorch-tutorial-for-deep-learning-lovers,Pytorch Tutorial for Deep Learning Lovers, DATAI,2020-04-06 13:29:40,1134,1
gunesevitan/nlp-with-disaster-tweets-eda-cleaning-and-bert,NLP with Disaster Tweets - EDA, Cleaning and BERT, Gunes Evitan, 2020-02-04 19:29:12,1121,1
keegil/keras-u-net-starter-lb-0-277, Keras U-Net starter - LB 0.277,Kjetil Åmdal-Sævik, 2018-01-21 00:13:39,1113,1
sudalairajkumar/simple-exploration-notebook-zillow-prize,Simple Exploration Notebook - Zillow Prize,SRK,2017-06-03 13:40:09,1097,1
artgor/eda-and-models, EDA and models,Andrew Lukyanenko,2019-09-03 02:24:55,1070,1
nadintamer/titanic-survival-predictions-beginner,Titanic Survival Predictions (Beginner), Nadin Tamer,2018-10-28 21:48:26,1057,1
christofhenkel/how-to-preprocessing-when-using-embeddings, How to: Preprocessing when using embeddings, Dieter, 2018-11-13 15:44:28,1055,1
sudalairajkumar/a-look-at-different-embeddings,A look at different embeddings.!,SRK,2018-11-08 09:37:34,1043,1
sudalairajkumar/simple-exploration-baseline-ga-customer-revenue, Simple Exploration+Baseline - GA Customer Revenue, SRK,2018-09-25 12:47:47,1038,1
jhoward/nb-svm-strong-linear-baseline, NB-SVM strong linear baseline, Jeremy Howard,2018-02-03 19:44:11,1033,1
vbmokin/data-science-for-tabular-data-advanced-techniques, Data Science for tabular data: Advanced Techniques,Vitalii Mokin,2021-09-05 16:15:48,1016,1
poonaml/deep-neural-network-keras-way, Deep Neural Network Keras way, Poonam Ligade,2018-07-09 09:53:52,1004,1
maksimeren/covid-19-literature-clustering, COVID-19 Literature Clustering,MaksimEkin, 2021-06-04 15:09:37,1001,1
davids1992/speech-representation-and-data-exploration, Speech representation and data exploration,DavidS, 2017-12-11 21:17:15,1001,1
kanncaa1/seaborn-tutorial-for-beginners, Seaborn Tutorial for Beginners,DATAI,2020-01-28 17:54:17,1000,1
dster/two-sigma-news-official-getting-started-kernel,Two Sigma News Official Getting Started Kernel,DJ Sterling,2018-10-03 19:41:21, 993,1
artgor/eda-feature-engineering-and-everything, EDA, feature engineering and everything, Andrew Lukyanenko,2019-02-21 18:49:15, 965,1
dlarionov/feature-engineering-xgboost, Feature engineering, xgboost,Denis Larionov, 2018-07-03 14:04:02, 963,1
residentmario/summary-functions-and-maps,Summary Functions and Maps,Aleksey Bilogur,2022-02-08 16:45:28, 963,1
dansbecker/xgboost,XGBoost, DanB, 2018-07-25 21:52:04, 949,1
kabure/extensive-eda-and-modeling-xgb-hyperopt,Extensive EDA and Modeling XGB Hyperopt, Leonardo Ferreira,2019-08-06 15:21:20, 945,1
residentmario/grouping-and-sorting,Grouping and Sorting,Aleksey Bilogur,2022-02-08 16:47:42, 927,1
dansbecker/permutation-importance, Permutation Importance,DanB, 2021-11-09 00:04:27, 926,1
carlmcbrideellis/jane-street-eda-of-day-0-and-feature-importance,Jane Street: EDA of day 0 and feature importance,Carl McBride Ellis, 2021-01-18 07:37:19, 913,1
juliencs/a-study-on-regression-applied-to-the-ames-dataset,A study on Regression applied to the Ames dataset, juliencs, 2021-03-18 15:16:37, 905,1
thykhuely/mercari-interactive-eda-topic-modelling, Mercari Interactive EDA + Topic Modelling, ThyKhueLy,2018-04-22 08:23:34, 896,1
jiashenliu/introduction-to-financial-concepts-and-data,Introduction to financial concepts and data, Jiashen Liu,2021-07-01 09:52:48, 891,1
dansbecker/getting-started-with-sql-and-bigquery,Getting Started With SQL and BigQuery, DanB, 2021-11-09 00:04:04, 883,1
alexisbcook/missing-values,Missing Values,Alexis Cook,2021-11-09 00:06:21, 877,1
parulpandey/10-simple-hacks-to-speed-up-your-data-analysis,10 Simple hacks to speed up your Data Analysis,Parul Pandey, 2020-02-11 04:32:49, 874,1
go1dfish/clear-mask-visualization-and-simple-eda,clear mask visualization and simple eda, GoldFish, 2019-09-24 14:59:27, 873,1
subinium/simple-matplotlib-visualization-tips, Simple Matplotlib & Visualization Tips 💡,Subin An, 2021-03-17 06:44:36, 872,1
tentotheminus9/what-causes-heart-disease-explaining-the-model, What Causes Heart Disease? Explaining the Model, Rob Harrand,2019-03-04 09:30:58, 869,1
caesarlupum/ashrae-start-here-a-gentle-introduction, 🔌⚡ASHRAE -Start Here: A GENTLE Introduction, Caesar Lupum, 2019-12-31 17:59:46, 865,1
lavanyashukla01/how-i-made-top-0-3-on-a-kaggle-competition,How I made top 0.3% on a Kaggle competition, Lavanya Shukla, 2019-06-09 21:10:44, 859,1
codename007/home-credit-complete-eda-feature-importance, Home Credit : Complete EDA + Feature Importance ✓✓,Lathwal,2018-06-08 11:56:26, 859,1
rafjaa/resampling-strategies-for-imbalanced-datasets,Resampling strategies for imbalanced datasets, Rafael Alencar, 2017-11-15 18:42:18, 855,1
ratthachat/aptos-eye-preprocessing-in-diabetic-retinopathy,APTOS : Eye Preprocessing in Diabetic Retinopathy, Jung, 2019-09-09 06:07:59, 852,1
arthurtok/spooky-nlp-and-topic-modelling-tutorial, Spooky NLP and Topic Modelling tutorial, Anisotropic,2018-11-05 20:45:27, 851,1
allunia/protein-atlas-exploration-and-baseline,Protein Atlas - Exploration and Baseline,Laura Fink, 2021-01-29 20:32:03, 848,1
janiobachmann/lending-club-risk-analysis-and-metrics, Lending Club || Risk Analysis and Metrics, Janio Martinez Bachmann, 2018-08-21 20:21:48, 839,2
dansbecker/using-categorical-data-with-one-hot-encoding,Using Categorical Data with One Hot Encoding,DanB,2018-01-22 00:36:58, 835,2
allunia/shaking-earth,Shaking Earth, Laura Fink,2019-02-04 08:11:02, 831,2
sentdex/first-pass-through-data-w-3d-convnet, First pass through Data w/ 3D ConvNet, Sentdex, 2017-02-10 14:10:30, 827,2
abhinand05/bert-for-humans-tutorial-baseline, BERT for Humans: Tutorial+Baseline,Abhinand,2020-01-12 15:50:46, 824,2
helgejo/an-interactive-data-science-tutorial, An Interactive Data Science Tutorial,Helge Bjorland,2017-01-28 19:54:58, 822,2
ash316/ml-from-scratch-with-iris, ML from Scratch with IRIS!!, Ashwini Swain, 2017-08-31 06:00:20, 805,2
fabiendaniel/customer-segmentation, Customer Segmentation, FabienDaniel,2019-03-21 14:19:41, 804,2
uysimty/keras-cnn-dog-or-cat-classification,Keras CNN Dog or Cat Classification, Uysim, 2019-06-16 02:14:44, 802,2
shonenkov/training-efficientdet,[Training] EfficientDet, Alex Shonenkov,2020-05-26 18:24:52, 795,2
robikscube/m5-forecasting-starter-data-exploration, M5 Forecasting,- Starter Data Exploration 📉,Rob Mulla, 2020-03-27 17:02:45, 785,2
arthurtok/interactive-intro-to-dimensionality-reduction,Interactive Intro to Dimensionality Reduction, Anisotropic, 2018-09-24 22:53:26, 784,2
jesperdramsch/intro-to-seismic-salt-and-how-to-geophysics,Intro to seismic, salt, and how to geophysics, Jesper Sören Dramsch,2018-07-20 12:47:51, 779,2
saga21/covid-global-forecast-sir-model-ml-regressions,COVID Global Forecast: SIR model + ML regressions, Patrick Sánchez, 2020-04-16 10:40:17, 772,2
dansbecker/intro-to-dl-for-computer-vision, Intro to DL for Computer Vision, DanB,2020-10-15 15:44:01, 766,2
dansbecker/selecting-and-filtering-in-pandas, Selecting and Filtering in Pandas, DanB,2018-01-29 04:38:58, 765,2
tarunpaparaju/lyft-competition-understanding-the-data,Lyft Competition : Understanding the data, Tarun Paparaju,2019-09-15 14:45:28, 759,2
burhanykiyakoglu/predicting-house-prices, Predicting House Prices, Burhan Y. Kiyakoglu, 2019-05-23 20:33:09, 753,2
ash316/novice-to-grandmaster, Novice to Grandmaster, Ashwini Swain, 2018-03-07 17:18:09, 752,2
jessemostipak/dive-into-dplyr-tutorial-1, Dive into dplyr (tutorial #1), Jesse Mostipak,2020-10-14 15:40:50, 749,2
kushal1996/customer-segmentation-k-means-analysis,Customer Segmentation (K-Means) | Analysis,Kushal Mahindrakar,2019-02-23 12:21:11, 747,2
kashnitsky/topic-1-exploratory-data-analysis-with-pandas, Topic 1. Exploratory Data Analysis with Pandas,Yury Kashnitsky, 2021-05-07 08:35:46, 746,2
willkoehrsen/introduction-to-manual-feature-engineering,Introduction to Manual Feature Engineering,Will Koehrsen, 2018-07-31 23:50:27, 741,2
faressayah/stock-market-analysis-prediction-using-lstm, 📊Stock Market Analysis 📈 + Prediction using LSTM,Fares Sayah, 2021-05-08 02:34:58, 740,2
joparga3/in-depth-skewed-data-classif-93-recall-acc-now,In depth skewed data classif. (93% recall acc now),joparga3,2016-12-17 09:03:25, 737,2
alexisbcook/hello-seaborn,Hello, Seaborn,Alexis Cook, 2021-11-09 00:05:44, 734,2
kneroma/m5-first-public-notebook-under-0-50,M5 First Public Notebook Under 0.50, kkiller, 2020-04-09 02:34:08, 733,2
kashnitsky/topic-9-part-1-time-series-analysis-in-python, Topic 9. Part 1. Time series analysis in Python, Yury Kashnitsky, 2021-01-04 00:01:49, 731,2
colinmorris/hello-python-daily, Hello, Python Daily, ColinMorris, 2019-06-24 18:15:58, 725,2
vishalyo990/prediction-of-quality-of-wine,Prediction of quality of Wine, Vishal Kumar,2018-01-19 14:35:37, 724,2
kanncaa1/time-series-prediction-tutorial-with-eda,Time Series Prediction Tutorial with EDA,DATAI, 2019-12-07 21:16:00, 722,2
bsivavenu/house-price-calculation-methods-for-beginners,House Price Calculation,methods for beginners,nikhil behra,2018-12-01 14:25:57, 719,2
artgor/segmentation-in-pytorch-using-convenient-tools,Segmentation in PyTorch using convenient tools,Andrew Lukyanenko, 2019-09-15 14:46:42, 707,2
kanncaa1/statistical-learning-tutorial-for-beginners, Statistical Learning Tutorial for Beginners, DATAI, 2018-09-09 13:39:20, 707,2
tarunpaparaju/m5-competition-eda-models,M5 Competition : EDA + Models 📈, Tarun Paparaju,2020-03-09 01:36:09, 704,2
alexisbcook/categorical-variables,Categorical Variables, Alexis Cook, 2021-11-09 00:07:00, 700,2
shrutimechlearn/step-by-step-diabetes-classification-knn-detailed,Step by Step Diabetes Classification-KNN-detailed, Shruti_Iyyer,2020-10-31 14:07:34, 698,2
cdabakoglu/heart-disease-classifications-machine-learning,Heart Disease - Classifications (Machine Learning),Caner Dabakoglu, 2019-08-07 06:20:35, 687,2
masumrumi/a-detailed-regression-guide-with-house-pricing, A Detailed Regression Guide with House-pricing,Masum Rumi,2021-11-15 21:46:57, 684,2
tarunpaparaju/plant-pathology-2020-eda-models,Plant Pathology 2020 : EDA + Models 🌿, Tarun Paparaju,2020-03-23 04:13:05, 683,2
thebrownviking20/intro-to-recurrent-neural-networks-lstm-gru, Intro to Recurrent Neural Networks LSTM | GRU, Siddharth Yadav, 2018-11-01 16:11:13, 683,2
piantic/osic-pulmonary-fibrosis-progression-basic-eda,OSIC Pulmonary Fibrosis Progression: Basic EDA!🔎,Heroseo, 2020-09-09 16:56:15, 680,2
ogrellier/feature-selection-with-null-importances,Feature Selection with Null Importances, olivier, 2018-06-14 06:44:06, 677,2
artgor/molecular-properties-eda-and-models, Molecular Properties EDA and models, Andrew Lukyanenko, 2019-07-18 04:29:46, 666,2
breemen/nyc-taxi-fare-data-exploration, NYC Taxi Fare - Data Exploration,Albert van Breemen,2018-08-27 08:30:58, 662,2
hortonhearsafoo/fast-ai-v3-lesson-1,fast.ai v3 lesson 1, William Horton,2019-02-02 23:32:47, 661,2
andradaolteanu/birdcall-recognition-eda-and-audio-fe, 🦉Birdcall Recognition: EDA and Audio FE, Andrada Olteanu, 2020-08-13 08:21:03, 657,2
artgor/earthquakes-fe-more-features-and-samples,Earthquakes FE. More features and samples, Andrew Lukyanenko, 2019-04-23 08:17:26, 654,2
kanncaa1/convolutional-neural-network-cnn-tutorial, Convolutional Neural Network (CNN) Tutorial, DATAI, 2020-10-29 12:24:11, 653,2
jagangupta/stop-the-s-toxic-comments-eda, Stop the S@#$ - Toxic Comments EDA,Jagan, 2018-03-11 10:00:52, 650,2
kakauandme/tensorflow-deep-nn,TensorFlow deep NN,Kirill Kliavin,2016-02-23 04:33:52, 649,2
rounakbanik/movie-recommender-systems,Movie Recommender Systems, Rounak Banik,2017-11-06 00:44:55, 642,2
shahules/an-overview-of-encoding-techniques,An Overview of Encoding Techniques,Shahules,2019-10-23 03:21:07, 641,2
ash316/terrorism-around-the-world,Terrorism Around The World,Ashwini Swain, 2018-03-02 05:02:32, 640,2
kyakovlev/m5-three-shades-of-dark-darker-magic, M5 - Three shades of Dark: Darker magic, Konstantin Yakovlev, 2020-04-17 10:35:23, 636,2
cdeotte/triple-stratified-kfold-with-tfrecords, Triple Stratified KFold with TFRecords,Chris Deotte,2020-07-13 17:59:40, 633,2
cstein06/tutorial-to-the-g-research-crypto-competition, Tutorial to the G-Research Crypto Competition, Carlos Stein N Brito,2022-01-11 13:53:29, 632,2
shivamb/cnn-architectures-vgg-resnet-inception-tl,CNN Architectures : VGG, ResNet, Inception + TL, Shivam Bansal, 2018-10-29 10:56:18, 632,2
artgor/quick-and-dirty-regression,Quick and dirty regression,Andrew Lukyanenko, 2019-11-21 15:10:59, 628,2
nxrprime/siim-d3-eda-augmentations-and-resnext, SIIM: d3 EDA, Augmentations and ResNeXt, Trigram, 2020-07-23 13:43:03, 623,2
pestipeti/pytorch-starter-fasterrcnn-train, Pytorch Starter - FasterRCNN Train,Peter, 2020-05-05 14:19:57, 623,2
faressayah/practical-introduction-to-10-regression-algorithm, Practical Introduction to 10 Regression Algorithm, Fares Sayah, 2022-01-20 13:43:02, 623,2
gpreda/deepfake-starter-kit,DeepFake Starter Kit,Gabriel Preda, 2020-02-05 09:36:03, 623,2
cdeotte/25-million-images-0-99757-mnist,25 Million Images! [0.99757] MNIST,Chris Deotte,2021-08-29 19:32:05, 623,2
rajmehra03/a-detailed-explanation-of-keras-embedding-layer, A Detailed Explanation of Keras Embedding Layer, Raj Mehrotra,2019-01-06 07:02:19, 612,2
artgor/exploration-of-data-step-by-step,Exploration of data step by step,Andrew Lukyanenko, 2019-03-15 08:27:40, 609,2
residentmario/univariate-plotting-with-pandas,Univariate plotting with pandas, Aleksey Bilogur, 2018-09-19 21:30:13, 609,2
erikbruin/riiid-comprehensive-eda-baseline, Riiid: Comprehensive EDA + Baseline, Erik Bruin,2020-12-17 10:28:54, 607,2
alexisbcook/pipelines,Pipelines, Alexis Cook, 2021-11-09 00:06:03, 605,2
sishihara/upura-kaggle-tutorial-01-first-submission,upura-kaggle-tutorial-01: first submission,u++, 2020-08-22 22:52:29, 602,2
kenjee/titanic-project-example, Titanic Project Example, Ken Jee, 2021-04-08 02:17:34, 601,2
sharmasanthosh/exploratory-study-on-ml-algorithms,Exploratory study on ML algorithms,Santhosh Sharma Ananthramu,2016-10-16 14:59:30, 600,2
hidehisaarai1213/introduction-to-sound-event-detection, Introduction to Sound Event Detection, Hidehisa Arai, 2020-08-14 10:26:19, 598,2
philculliton/nlp-getting-started-tutorial,NLP Getting Started Tutorial,Phil Culliton, 2019-12-20 18:35:44, 585,2
fizzbuzz/beginner-s-guide-to-audio-data,Beginner's Guide to Audio Data,Zafar, 2018-04-12 05:41:34, 582,2
dansbecker/rectified-linear-units-relu-in-deep-learning,Rectified Linear Units (ReLU) in Deep Learning,DanB,2018-05-07 20:17:04, 582,2
aruchomu/yolo-v3-object-detection-in-tensorflow,Yolo v3 Object Detection in Tensorflow,heartkilla,2019-02-21 11:12:34, 581,2
maheshdadhich/strength-of-visualization-python-visuals-tutorial,Strength of visualization-python visuals tutorial, BuryBuryZymon, 2017-09-17 13:33:16, 581,2
alexisbcook/xgboost,XGBoost, Alexis Cook, 2021-11-09 00:07:03, 579,2
sudalairajkumar/simple-exploration-notebook-instacart,Simple Exploration Notebook - Instacart, SRK, 2017-06-02 04:20:53, 579,2
yag320/list-of-fake-samples-and-public-private-lb-split,List of Fake Samples and Public/Private LB split,YaG320,2019-03-23 00:27:32, 578,2
fabiendaniel/film-recommendation-engine,Film recommendation engine,FabienDaniel,2017-11-27 08:13:28, 576,2
jesucristo/gan-introduction,GAN Introduction,Nanashi, 2019-07-01 09:10:43, 573,2
sudalairajkumar/getting-started-with-text-preprocessing,Getting started with Text Preprocessing, SRK, 2019-08-20 07:28:07, 572,2
fabiendaniel/elo-world, Elo world, FabienDaniel,2018-12-13 17:08:06, 572,2
dansbecker/tensorflow-programming,TensorFlow Programming,DanB,2020-10-15 15:44:29, 571,2
sbongo/for-beginners-tackling-toxic-using-keras,[For Beginners] Tackling Toxic Using Keras,Bongo, 2018-01-24 08:43:28, 567,2
cdeotte/pseudo-labeling-qda-0-969,Pseudo Labeling - QDA - [0.969], Chris Deotte,2021-08-31 02:50:26, 564,2
fabiendaniel/predicting-flight-delays-tutorial, Predicting flight delays [Tutorial], FabienDaniel,2017-10-03 17:43:13, 562,2
cdeotte/how-to-choose-cnn-architecture-mnist, How to choose CNN Architecture MNIST,Chris Deotte,2018-09-24 16:32:10, 560,2
awsaf49/great-barrier-reef-yolov5-train,Great-Barrier-Reef: YOLOv5 [train] 🌊,Awsaf, 2022-01-18 14:07:03, 558,2
alexisbcook/data-leakage, Data Leakage,Alexis Cook, 2021-11-09 00:06:51, 558,2
iafoss/pretrained-resnet34-with-rgby-0-460-public-lb, pretrained ResNet34 with RGBY (0.460 public LB), Iafoss,2018-12-23 15:49:18, 558,2
gpreda/lanl-earthquake-eda-and-prediction,LANL Earthquake EDA and Prediction,Gabriel Preda, 2019-04-07 13:25:23, 557,2
ekami66/detailed-exploratory-data-analysis-with-python, Detailed exploratory data analysis with python,Tuatini GODARD,2017-01-20 02:06:37, 554,2
yuliagm/how-to-work-with-big-datasets-on-16g-ram-dask,How to Work with BIG Datasets on 16G RAM (+Dask),yulia, 2018-03-12 22:01:47, 552,2
sudalairajkumar/simple-exploration-notebook-qiqc, Simple Exploration Notebook - QIQC,SRK, 2018-11-07 10:09:20, 548,2
jiweiliu/lgb-2-leaves-augment,LGB 2 leaves + augment,Jiwei Liu, 2019-03-15 17:46:58, 547,2
isaienkov/mechanisms-of-action-moa-prediction-eda,Mechanisms of Action (MoA) Prediction. EDA,Kostiantyn Isaienkov,2020-11-30 22:04:52, 546,2
rishabhiitbhu/unet-starter-kernel-pytorch-lb-0-88,UNet starter kernel (Pytorch) LB>0.88, Rishabh Agrahari,2019-10-20 17:25:23, 546,2
pmarcelino/data-analysis-and-feature-extraction-with-python, Data analysis and feature extraction with Python,Pedro Marcelino, PhD, 2019-08-02 04:38:42, 543,3
residentmario/renaming-and-combining,Renaming and Combining,Aleksey Bilogur,2022-02-08 16:44:41, 540,3
residentmario/data-types-and-missing-values, Data Types and Missing Values, Aleksey Bilogur,2022-02-08 16:48:25, 540,3
jeffd23/scikit-learn-ml-from-start-to-finish,Scikit-Learn ML from Start to Finish,Jeff Delaney, 2016-08-03 12:53:14, 536,3
theoviel/deep-learning-starter-simple-lstm,Deep Learning Starter : Simple LSTM, Theo Viel,2021-09-23 21:19:58, 532,3
amyjang/monet-cyclegan-tutorial, Monet CycleGAN Tutorial, Amy Jang, 2020-08-29 08:26:50, 526,3
theoviel/improve-your-score-with-some-text-preprocessing,Improve your Score with some Text Preprocessing, Theo Viel,2018-12-03 14:18:15, 524,3
jesucristo/1-house-prices-solution-top-1,#1 House Prices Solution [top 1%], Nanashi,2019-09-06 08:36:08, 523,3
summitkwan/tl-gan-demo,tl-GAN demo, Summit, 2018-10-09 05:59:56, 522,3
rtatman/data-cleaning-challenge-scale-and-normalize-data,Data Cleaning Challenge: Scale and Normalize Data, Rachael Tatman, 2018-03-30 21:18:36, 522,3
viveksrinivasan/eda-ensemble-model-top-10-percentile,EDA & Ensemble Model (Top 10 Percentile),Vivek Srinivasan, 2017-04-23 04:54:22, 521,3
nareshbhat/outlier-the-silent-killer,Outlier!!! The Silent Killer,Naresh Bhat,2021-08-30 07:18:27, 520,3
allunia/pulmonary-dicom-preprocessing, Pulmonary Dicom Preprocessing, Laura Fink, 2021-06-17 19:20:07, 518,3
